{
  "bundle_version": "2.0",
  "bundle_id": "update-full-001",
  "generated_at": "2026-08-08T10:00:00Z",
  "prompt_context_ref": "prompt-snapshot-full-001",
  "research_scope": {"type": "full_update", "as_of_date": "2026-08-08"},
  "sources": [{"id": "src-careers", "name": "Example Careers", "type": "company_careers", "base_url": "https://example.com"}],
  "source_references": [{"id": "ref-job", "source_id": "src-careers", "url": "https://example.com/jobs/dev", "observed_at": "2026-08-08T09:00:00Z"}],
  "companies": [{"id": "company-new", "canonical_name": "Example GmbH", "source_reference_id": "ref-job", "observed_at": "2026-08-08T09:00:00Z", "evidence_summary": "Official careers page"}],
  "opportunities": [{"id": "opportunity-new", "company_id": "company-new", "canonical_title": "Junior Developer", "source_reference_id": "ref-job", "observed_at": "2026-08-08T09:00:00Z", "work_locations": [{"label": "Hamburg", "precision": "city", "source_reference_id": "ref-job", "observed_at": "2026-08-08T09:00:00Z"}]}, {"id": "opportunity-other", "company_id": "company-new", "canonical_title": "Backend Developer", "source_reference_id": "ref-job", "observed_at": "2026-08-08T09:00:00Z", "work_locations": []}],
  "postings": [{"id": "posting-new", "company_id": "company-new", "opportunity_id": "opportunity-new", "source_reference_id": "ref-job", "title": "Junior Developer", "external_posting_id": "job-1", "observed_at": "2026-08-08T09:00:00Z"}],
  "observations": [{"id": "observation-1", "subject_type": "opportunity", "subject_id": "opportunity-new", "type": "technology_requirement", "value": ["Python"], "source_reference_id": "ref-job", "observed_at": "2026-08-08T09:00:00Z", "evidence_summary": "Requirements"}],
  "assessments": [{"id": "assessment-1", "subject_type": "opportunity", "subject_id": "opportunity-new", "criterion_id": "junior_suitability", "value": 4, "origin": "external_research", "source_reference_ids": ["ref-job"], "created_at": "2026-08-08T09:00:00Z"}],
  "possible_duplicates": [{"id": "duplicate-evidence-1", "subject_type": "opportunity", "left_subject_id": "opportunity-new", "right_subject_id": "opportunity-other", "source_reference_ids": ["ref-job"], "evidence_summary": "Similar role wording", "confidence": 0.6}],
  "warnings": []
}
