{
  "bundle_version": "2.0",
  "bundle_id": "update-gap-001",
  "generated_at": "2026-08-08T10:00:00Z",
  "prompt_context_ref": "prompt-snapshot-gap-001",
  "research_scope": {"type": "gap_filling", "as_of_date": "2026-08-08", "selected_correlation_refs": ["opportunity-reference-2"], "requests": [{"subject_type": "opportunity", "correlation_ref": "opportunity-reference-2", "observation_type": "salary"}, {"subject_type": "opportunity", "correlation_ref": "opportunity-reference-2", "criterion_id": "technology_fit"}]},
  "sources": [{"id": "src-gap", "name": "Example Careers", "type": "company_careers"}],
  "source_references": [{"id": "ref-gap", "source_id": "src-gap", "url": "https://example.com/jobs/existing", "observed_at": "2026-08-08T09:00:00Z"}],
  "companies": [{"id": "company-context", "correlation_ref": "company-reference-3"}],
  "opportunities": [{"id": "opportunity-known", "company_id": "company-context", "correlation_ref": "opportunity-reference-2"}],
  "postings": [{"id": "posting-context", "company_id": "company-context", "opportunity_id": "opportunity-known", "correlation_ref": "posting-reference-2"}],
  "observations": [{"id": "observation-salary", "subject_type": "opportunity", "subject_id": "opportunity-known", "type": "salary", "value": "60000-70000 EUR", "source_reference_id": "ref-gap", "observed_at": "2026-08-08T09:00:00Z"}],
  "assessments": [{"id": "assessment-fit", "subject_type": "opportunity", "subject_id": "opportunity-known", "criterion_id": "technology_fit", "value": 4, "origin": "external_research", "source_reference_ids": ["ref-gap"], "created_at": "2026-08-08T09:00:00Z"}],
  "possible_duplicates": [], "warnings": []
}
